{
  "schema_version": "v0alpha2",
  "source": {
    "repository": "github.com/apstndb/spanalyzer",
    "registry_path": "survey/infoschem",
    "registry_export_sha256": "2a569cf756e131ba73ef048c956d9c38905c928ed0ff6bdccde3e79bf138cc85",
    "selected_observation_path": "survey/infoschem/evidence/managed/20260825T120538Z-f8b0ea3092e7.json",
    "selected_observation_file_sha256": "94e8c662f3e719d2ebe3143f39d0473c5c6f27d7255d3cc1a8ee3d711047802f",
    "observed_at": "2026-08-25T12:05:38.437354Z",
    "surface_sha256": "f8b0ea3092e7601f260d6d9cb59002dcd0cf4fba6283df8a7c04c004e6a664ee",
    "producer_source_sha256": "b0321b75b16fbec130be2e0af15fdc0204ad5d2bb451576102448958bf36f5e3",
    "invocation_sha256": "172d84c2f8c48372ff2500088d54918b90a88c9b53d90d6f602ce0553c05cb4c",
    "projection_source_path": "information_schema_projection_source.json",
    "projection_source_sha256": "7d5a008d5886a32e6583a72356fd503197712442a42ff4df9de67187ebb3e625"
  },
  "documentation": {
    "url": "https://docs.cloud.google.com/spanner/docs/information-schema",
    "last_updated": "2026-08-15"
  },
  "content_sha256": "6040e547c6d5153264a4eac3df0b4224ef333b6b456e172ec0f1c55a045a9db7",
  "tables": [
    {
      "name": "CHANGE_STREAMS",
      "columns": [
        {
          "name": "CHANGE_STREAM_CATALOG",
          "ordinal": 1,
          "raw_type": "STRING(MAX)",
          "evidence_status": "live_observed",
          "project": true
        },
        {
          "name": "CHANGE_STREAM_SCHEMA",
          "ordinal": 2,
          "raw_type": "STRING(MAX)",
          "evidence_status": "live_observed",
          "project": true
        },
        {
          "name": "CHANGE_STREAM_NAME",
          "ordinal": 3,
          "raw_type": "STRING(MAX)",
          "evidence_status": "live_observed",
          "project": true
        },
        {
          "name": "ALL",
          "ordinal": 4,
          "raw_type": "BOOL",
          "evidence_status": "live_observed",
          "project": true
        }
      ]
    },
    {
      "name": "CHANGE_STREAM_COLUMNS",
      "columns": [
        {
          "name": "CHANGE_STREAM_CATALOG",
          "ordinal": 1,
          "raw_type": "STRING(MAX)",
          "evidence_status": "live_observed",
          "project": true
        },
        {
          "name": "CHANGE_STREAM_SCHEMA",
          "ordinal": 2,
          "raw_type": "STRING(MAX)",
          "evidence_status": "live_observed",
          "project": true
        },
        {
          "name": "CHANGE_STREAM_NAME",
          "ordinal": 3,
          "raw_type": "STRING(MAX)",
          "evidence_status": "live_observed",
          "project": true
        },
        {
          "name": "TABLE_CATALOG",
          "ordinal": 4,
          "raw_type": "STRING(MAX)",
          "evidence_status": "live_observed",
          "project": true
        },
        {
          "name": "TABLE_SCHEMA",
          "ordinal": 5,
          "raw_type": "STRING(MAX)",
          "evidence_status": "live_observed",
          "project": true
        },
        {
          "name": "TABLE_NAME",
          "ordinal": 6,
          "raw_type": "STRING(MAX)",
          "evidence_status": "live_observed",
          "project": true
        },
        {
          "name": "COLUMN_NAME",
          "ordinal": 7,
          "raw_type": "STRING(MAX)",
          "evidence_status": "live_observed",
          "project": true
        }
      ]
    },
    {
      "name": "CHANGE_STREAM_OPTIONS",
      "columns": [
        {
          "name": "CHANGE_STREAM_CATALOG",
          "ordinal": 1,
          "raw_type": "STRING(MAX)",
          "evidence_status": "live_observed",
          "project": true
        },
        {
          "name": "CHANGE_STREAM_SCHEMA",
          "ordinal": 2,
          "raw_type": "STRING(MAX)",
          "evidence_status": "live_observed",
          "project": true
        },
        {
          "name": "CHANGE_STREAM_NAME",
          "ordinal": 3,
          "raw_type": "STRING(MAX)",
          "evidence_status": "live_observed",
          "project": true
        },
        {
          "name": "OPTION_NAME",
          "ordinal": 4,
          "raw_type": "STRING(MAX)",
          "evidence_status": "live_observed",
          "project": true
        },
        {
          "name": "OPTION_TYPE",
          "ordinal": 5,
          "raw_type": "STRING(MAX)",
          "evidence_status": "live_observed",
          "project": true
        },
        {
          "name": "OPTION_VALUE",
          "ordinal": 6,
          "raw_type": "STRING(MAX)",
          "evidence_status": "live_observed",
          "project": true
        }
      ]
    },
    {
      "name": "CHANGE_STREAM_PRIVILEGES",
      "columns": [
        {
          "name": "CHANGE_STREAM_CATALOG",
          "ordinal": 1,
          "raw_type": "STRING(MAX)",
          "evidence_status": "live_observed",
          "project": true
        },
        {
          "name": "CHANGE_STREAM_SCHEMA",
          "ordinal": 2,
          "raw_type": "STRING(MAX)",
          "evidence_status": "live_observed",
          "project": true
        },
        {
          "name": "CHANGE_STREAM_NAME",
          "ordinal": 3,
          "raw_type": "STRING(MAX)",
          "evidence_status": "live_observed",
          "project": true
        },
        {
          "name": "PRIVILEGE_TYPE",
          "ordinal": 4,
          "raw_type": "STRING(MAX)",
          "evidence_status": "live_observed",
          "project": true
        },
        {
          "name": "GRANTEE",
          "ordinal": 5,
          "raw_type": "STRING(MAX)",
          "evidence_status": "live_observed",
          "project": true
        }
      ]
    },
    {
      "name": "CHANGE_STREAM_TABLES",
      "columns": [
        {
          "name": "CHANGE_STREAM_CATALOG",
          "ordinal": 1,
          "raw_type": "STRING(MAX)",
          "evidence_status": "live_observed",
          "project": true
        },
        {
          "name": "CHANGE_STREAM_SCHEMA",
          "ordinal": 2,
          "raw_type": "STRING(MAX)",
          "evidence_status": "live_observed",
          "project": true
        },
        {
          "name": "CHANGE_STREAM_NAME",
          "ordinal": 3,
          "raw_type": "STRING(MAX)",
          "evidence_status": "live_observed",
          "project": true
        },
        {
          "name": "TABLE_CATALOG",
          "ordinal": 4,
          "raw_type": "STRING(MAX)",
          "evidence_status": "live_observed",
          "project": true
        },
        {
          "name": "TABLE_SCHEMA",
          "ordinal": 5,
          "raw_type": "STRING(MAX)",
          "evidence_status": "live_observed",
          "project": true
        },
        {
          "name": "TABLE_NAME",
          "ordinal": 6,
          "raw_type": "STRING(MAX)",
          "evidence_status": "live_observed",
          "project": true
        },
        {
          "name": "ALL_COLUMNS",
          "ordinal": 7,
          "raw_type": "BOOL",
          "evidence_status": "live_observed",
          "project": true
        }
      ]
    },
    {
      "name": "CHECK_CONSTRAINTS",
      "columns": [
        {
          "name": "CONSTRAINT_CATALOG",
          "ordinal": 1,
          "raw_type": "STRING(MAX)",
          "evidence_status": "live_observed",
          "project": true
        },
        {
          "name": "CONSTRAINT_SCHEMA",
          "ordinal": 2,
          "raw_type": "STRING(MAX)",
          "evidence_status": "live_observed",
          "project": true
        },
        {
          "name": "CONSTRAINT_NAME",
          "ordinal": 3,
          "raw_type": "STRING(MAX)",
          "evidence_status": "live_observed",
          "project": true
        },
        {
          "name": "CHECK_CLAUSE",
          "ordinal": 4,
          "raw_type": "STRING(MAX)",
          "evidence_status": "live_observed",
          "project": true
        },
        {
          "name": "SPANNER_STATE",
          "ordinal": 5,
          "raw_type": "STRING(MAX)",
          "evidence_status": "live_observed",
          "project": true
        }
      ]
    },
    {
      "name": "COLUMNS",
      "columns": [
        {
          "name": "TABLE_CATALOG",
          "ordinal": 1,
          "raw_type": "STRING(MAX)",
          "evidence_status": "live_observed",
          "project": true
        },
        {
          "name": "TABLE_SCHEMA",
          "ordinal": 2,
          "raw_type": "STRING(MAX)",
          "evidence_status": "live_observed",
          "project": true
        },
        {
          "name": "TABLE_NAME",
          "ordinal": 3,
          "raw_type": "STRING(MAX)",
          "evidence_status": "live_observed",
          "project": true
        },
        {
          "name": "COLUMN_NAME",
          "ordinal": 4,
          "raw_type": "STRING(MAX)",
          "evidence_status": "live_observed",
          "project": true
        },
        {
          "name": "ORDINAL_POSITION",
          "ordinal": 5,
          "raw_type": "INT64",
          "evidence_status": "live_observed",
          "project": true
        },
        {
          "name": "COLUMN_DEFAULT",
          "ordinal": 6,
          "raw_type": "STRING(MAX)",
          "evidence_status": "live_observed",
          "project": true
        },
        {
          "name": "DATA_TYPE",
          "ordinal": 7,
          "raw_type": "STRING(MAX)",
          "evidence_status": "live_observed",
          "project": true
        },
        {
          "name": "IS_NULLABLE",
          "ordinal": 8,
          "raw_type": "STRING(MAX)",
          "evidence_status": "live_observed",
          "project": true
        },
        {
          "name": "SPANNER_TYPE",
          "ordinal": 9,
          "raw_type": "STRING(MAX)",
          "evidence_status": "live_observed",
          "project": true
        },
        {
          "name": "IS_GENERATED",
          "ordinal": 10,
          "raw_type": "STRING(MAX)",